country,query
Afghanistan,investment opportunities in Afghanistan
Albania,investment opportunities in Albania
Algeria,investment opportunities in Algeria
Andorra,investment opportunities in Andorra
Angola,investment opportunities in Angola
Antigua and Barbuda,investment opportunities in Antigua and Barbuda
Argentina,investment opportunities in Argentina
Armenia,investment opportunities in Armenia
Australia,investment opportunities in Australia
Austria,investment opportunities in Austria
Azerbaijan,investment opportunities in Azerbaijan
Bahamas,investment opportunities in Bahamas
Bahrain,investment opportunities in Bahrain
Bangladesh,investment opportunities in Bangladesh
Barbados,investment opportunities in Barbados
Belarus,investment opportunities in Belarus
Belgium,investment opportunities in Belgium
Belize,investment opportunities in Belize
Benin,investment opportunities in Benin
Bhutan,investment opportunities in Bhutan
Bolivia,investment opportunities in Bolivia
Bosnia and Herzegovina,investment opportunities in Bosnia and Herzegovina
Botswana,investment opportunities in Botswana
Brazil,investment opportunities in Brazil
Brunei,investment opportunities in Brunei
Bulgaria,investment opportunities in Bulgaria
Burkina Faso,investment opportunities in Burkina Faso
Burundi,investment opportunities in Burundi
Cabo Verde,investment opportunities in Cabo Verde
Cambodia,investment opportunities in Cambodia
Cameroon,investment opportunities in Cameroon
Canada,investment opportunities in Canada
Central African Republic,investment opportunities in Central African Republic
Chad,investment opportunities in Chad
Chile,investment opportunities in Chile
China,investment opportunities in China
Colombia,investment opportunities in Colombia
Comoros,investment opportunities in Comoros
Congo,investment opportunities in Congo
Costa Rica,investment opportunities in Costa Rica
Cote d'Ivoire,investment opportunities in Cote d'Ivoire
Croatia,investment opportunities in Croatia
Cuba,investment opportunities in Cuba
Cyprus,investment opportunities in Cyprus
Czechia,investment opportunities in Czechia
North Korea,investment opportunities in North Korea
Democratic Republic of the Congo,investment opportunities in Democratic Republic of the Congo
Denmark,investment opportunities in Denmark
Djibouti,investment opportunities in Djibouti
Dominica,investment opportunities in Dominica
Dominican Republic,investment opportunities in Dominican Republic
Ecuador,investment opportunities in Ecuador
Egypt,investment opportunities in Egypt
El Salvador,investment opportunities in El Salvador
Equatorial Guinea,investment opportunities in Equatorial Guinea
Eritrea,investment opportunities in Eritrea
Estonia,investment opportunities in Estonia
Eswatini,investment opportunities in Eswatini
Ethiopia,investment opportunities in Ethiopia
Fiji,investment opportunities in Fiji
Finland,investment opportunities in Finland
France,investment opportunities in France
Gabon,investment opportunities in Gabon
Gambia,investment opportunities in Gambia
Georgia,investment opportunities in Georgia
Germany,investment opportunities in Germany
Ghana,investment opportunities in Ghana
Greece,investment opportunities in Greece
Grenada,investment opportunities in Grenada
Guatemala,investment opportunities in Guatemala
Guinea,investment opportunities in Guinea
Guinea-Bissau,investment opportunities in Guinea-Bissau
Guyana,investment opportunities in Guyana
Haiti,investment opportunities in Haiti
Honduras,investment opportunities in Honduras
Hungary,investment opportunities in Hungary
Iceland,investment opportunities in Iceland
India,investment opportunities in India
Indonesia,investment opportunities in Indonesia
Iran,investment opportunities in Iran
Iraq,investment opportunities in Iraq
Ireland,investment opportunities in Ireland
Israel,investment opportunities in Israel
Italy,investment opportunities in Italy
Jamaica,investment opportunities in Jamaica
Japan,investment opportunities in Japan
Jordan,investment opportunities in Jordan
Kazakhstan,investment opportunities in Kazakhstan
Kenya,investment opportunities in Kenya
Kiribati,investment opportunities in Kiribati
Kuwait,investment opportunities in Kuwait
Kyrgyzstan,investment opportunities in Kyrgyzstan
Laos,investment opportunities in Laos
Latvia,investment opportunities in Latvia
Lebanon,investment opportunities in Lebanon
Lesotho,investment opportunities in Lesotho
Liberia,investment opportunities in Liberia
Libya,investment opportunities in Libya
Liechtenstein,investment opportunities in Liechtenstein
Lithuania,investment opportunities in Lithuania
Luxembourg,investment opportunities in Luxembourg
Madagascar,investment opportunities in Madagascar
Malawi,investment opportunities in Malawi
Malaysia,investment opportunities in Malaysia
Maldives,investment opportunities in Maldives
Mali,investment opportunities in Mali
Malta,investment opportunities in Malta
Marshall Islands,investment opportunities in Marshall Islands
Mauritania,investment opportunities in Mauritania
Mauritius,investment opportunities in Mauritius
Mexico,investment opportunities in Mexico
Micronesia,investment opportunities in Micronesia
Moldova,investment opportunities in Moldova
Monaco,investment opportunities in Monaco
Mongolia,investment opportunities in Mongolia
Montenegro,investment opportunities in Montenegro
Morocco,investment opportunities in Morocco
Mozambique,investment opportunities in Mozambique
Myanmar,investment opportunities in Myanmar
Namibia,investment opportunities in Namibia
Nauru,investment opportunities in Nauru
Nepal,investment opportunities in Nepal
Netherlands,investment opportunities in Netherlands
New Zealand,investment opportunities in New Zealand
Nicaragua,investment opportunities in Nicaragua
Niger,investment opportunities in Niger
Nigeria,investment opportunities in Nigeria
North Macedonia,investment opportunities in North Macedonia
Norway,investment opportunities in Norway
Oman,investment opportunities in Oman
Pakistan,investment opportunities in Pakistan
Palau,investment opportunities in Palau
Panama,investment opportunities in Panama
Papua New Guinea,investment opportunities in Papua New Guinea
Paraguay,investment opportunities in Paraguay
Peru,investment opportunities in Peru
Philippines,investment opportunities in Philippines
Poland,investment opportunities in Poland
Portugal,investment opportunities in Portugal
Qatar,investment opportunities in Qatar
Romania,investment opportunities in Romania
Russia,investment opportunities in Russia
Rwanda,investment opportunities in Rwanda
Saint Kitts and Nevis,investment opportunities in Saint Kitts and Nevis
Saint Lucia,investment opportunities in Saint Lucia
Saint Vincent and the Grenadines,investment opportunities in Saint Vincent and the Grenadines
Samoa,investment opportunities in Samoa
San Marino,investment opportunities in San Marino
Sao Tome and Principe,investment opportunities in Sao Tome and Principe
Saudi Arabia,investment opportunities in Saudi Arabia
Senegal,investment opportunities in Senegal
Serbia,investment opportunities in Serbia
Seychelles,investment opportunities in Seychelles
Sierra Leone,investment opportunities in Sierra Leone
Singapore,investment opportunities in Singapore
Slovakia,investment opportunities in Slovakia
Slovenia,investment opportunities in Slovenia
Solomon Islands,investment opportunities in Solomon Islands
Somalia,investment opportunities in Somalia
South Africa,investment opportunities in South Africa
South Korea,investment opportunities in South Korea
South Sudan,investment opportunities in South Sudan
Spain,investment opportunities in Spain
Sri Lanka,investment opportunities in Sri Lanka
Sudan,investment opportunities in Sudan
Suriname,investment opportunities in Suriname
Sweden,investment opportunities in Sweden
Switzerland,investment opportunities in Switzerland
Syria,investment opportunities in Syria
Tajikistan,investment opportunities in Tajikistan
Tanzania,investment opportunities in Tanzania
Thailand,investment opportunities in Thailand
Timor-Leste,investment opportunities in Timor-Leste
Togo,investment opportunities in Togo
Tonga,investment opportunities in Tonga
Trinidad and Tobago,investment opportunities in Trinidad and Tobago
Tunisia,investment opportunities in Tunisia
Turkey,investment opportunities in Turkey
Turkmenistan,investment opportunities in Turkmenistan
Tuvalu,investment opportunities in Tuvalu
Uganda,investment opportunities in Uganda
Ukraine,investment opportunities in Ukraine
United Arab Emirates,investment opportunities in United Arab Emirates
United Kingdom,investment opportunities in United Kingdom
United States,investment opportunities in United States
Uruguay,investment opportunities in Uruguay
Uzbekistan,investment opportunities in Uzbekistan
Vanuatu,investment opportunities in Vanuatu
Venezuela,investment opportunities in Venezuela
Vietnam,investment opportunities in Vietnam
Yemen,investment opportunities in Yemen
Zambia,investment opportunities in Zambia
Zimbabwe,investment opportunities in Zimbabwe
Holy See,investment opportunities in Holy See
Palestine,investment opportunities in Palestine
Taiwan,investment opportunities in Taiwan
Kosovo,investment opportunities in Kosovo
